================================================================================
Date and Time: 2025-12-01 03:02:05

Run Scenario Name: TwoAssetImaging_ToyExample

Git Repository Root (Absolute Local Path): /Users/jason/source/Horizon
Git Repo Origin URL: https://github.com/Cal-Poly-Simulation-Lab/Horizon.git
Git Branch (ran): jebeals-scheduler
Git Commit (ran): 88c368f00766504f75ca2001fe7ea4edf5d631f6
Git Working Tree Status: DIRTY (see .repo_state/ for details)
  → Exact git repo state data saved in ./.repo_state/
Git User (who ran): jebeals

Local File Executable that was ran (absolute path): /Users/jason/source/Horizon/src/Horizon/bin/Debug/net8.0/Horizon
Repo-Relative executable path: src/Horizon/bin/Debug/net8.0/Horizon

Relative Input Paths (from repo root):
  SimInputFile: test/HSFSchedulerUnitTest/GenerateProgramHashes/Inputs/SimInput_TwoAssetImaging_ToyExample.json
  ModelInputFile: test/HSFSchedulerUnitTest/GenerateProgramHashes/Inputs/TwoAsset_Imaging_Model.json
  TaskInputFile: test/HSFSchedulerUnitTest/GenerateProgramHashes/Inputs/TwoAsset_Imaging_Tasks.json

================================================================================
All console output:

Loading tasks into simulation... for scenario TwoAssetImaging_ToyExample.  
Loaded 3 tasks for scenario TwoAssetImaging_ToyExample.
Default Space Environment Loaded
Environment, 2 Assets, Subsystems, and Constraints Loaded
Dependencies Loaded
DefaultEvaluator Evaluator Loaded
Evaluator Loaded

================================================================================
SCHEDULE SUMMARY - Step 0 in   0.0292s | Total Schedules:       5 
 Status:  0.0% ... Generated:     4 | Carried Over:     1 | Cropped:     0
================================================================================
Time:  [ 0][-][-][-][-][-][-][-][-][-]
--------------------------------------------------------------------------------
            5 | Val:     20.00 | Ev: 1 | [1][-][-][-][-][-][-][-][-][-]
            6 | Val:     11.00 | Ev: 1 | [1][-][-][-][-][-][-][-][-][-]
            8 | Val:     11.00 | Ev: 1 | [1][-][-][-][-][-][-][-][-][-]
            9 | Val:      2.00 | Ev: 1 | [1][-][-][-][-][-][-][-][-][-]
            0 | Val:      0.00 | Ev: 0 | [0][-][-][-][-][-][-][-][-][-]
--------------------------------------------------------------------------------


================================================================================
SCHEDULE SUMMARY - Step 1 in   0.0041s | Total Schedules:      25 
 Status: 10.0% ... Generated:    20 | Carried Over:     5 | Cropped:     0
================================================================================
Time:  [ 0][ 1][-][-][-][-][-][-][-][-]
--------------------------------------------------------------------------------
          5.1 | Val:    120.00 | Ev: 2 | [1][1][-][-][-][-][-][-][-][-]
          5.4 | Val:     80.00 | Ev: 2 | [1][1][-][-][-][-][-][-][-][-]
          5.2 | Val:     80.00 | Ev: 2 | [1][1][-][-][-][-][-][-][-][-]
          5.3 | Val:     71.00 | Ev: 2 | [1][1][-][-][-][-][-][-][-][-]
          6.2 | Val:     71.00 | Ev: 2 | [1][1][-][-][-][-][-][-][-][-]
          8.4 | Val:     71.00 | Ev: 2 | [1][1][-][-][-][-][-][-][-][-]
          5.7 | Val:     71.00 | Ev: 2 | [1][1][-][-][-][-][-][-][-][-]
          5.5 | Val:     40.00 | Ev: 2 | [1][1][-][-][-][-][-][-][-][-]
          8.5 | Val:     31.00 | Ev: 2 | [1][1][-][-][-][-][-][-][-][-]
          5.6 | Val:     31.00 | Ev: 2 | [1][1][-][-][-][-][-][-][-][-]
          6.5 | Val:     31.00 | Ev: 2 | [1][1][-][-][-][-][-][-][-][-]
                               .
                               .
                               .
 [SytemScheduleInfo]: 15 evalutated schedules not printed... 
 Schedule printing truncated at 10 given ConsoleLogMode = 'truncate'. Top 10 shown above. 
 (Note: these 15 generated and evlauted this scheduler timestep (from either/both carried over and new schedules).
--------------------------------------------------------------------------------


================================================================================
SCHEDULE SUMMARY - Step 2 in   0.0218s | Total Schedules:     142 
 Status: 20.0% ... Generated:   117 | Carried Over:    25 | Cropped:     0
================================================================================
Time:  [ 0][ 1][ 2][-][-][-][-][-][-][-]
--------------------------------------------------------------------------------
        5.4.2 | Val:    140.00 | Ev: 3 | [1][1][1][-][-][-][-][-][-][-]
        5.2.4 | Val:    140.00 | Ev: 3 | [1][1][1][-][-][-][-][-][-][-]
        5.5.1 | Val:    140.00 | Ev: 3 | [1][1][1][-][-][-][-][-][-][-]
        5.1.5 | Val:    140.00 | Ev: 3 | [1][1][1][-][-][-][-][-][-][-]
        5.2.7 | Val:    131.00 | Ev: 3 | [1][1][1][-][-][-][-][-][-][-]
        5.8.1 | Val:    131.00 | Ev: 3 | [1][1][1][-][-][-][-][-][-][-]
        5.6.1 | Val:    131.00 | Ev: 3 | [1][1][1][-][-][-][-][-][-][-]
        5.1.8 | Val:    131.00 | Ev: 3 | [1][1][1][-][-][-][-][-][-][-]
        8.5.1 | Val:    131.00 | Ev: 3 | [1][1][1][-][-][-][-][-][-][-]
        5.7.2 | Val:    131.00 | Ev: 3 | [1][1][1][-][-][-][-][-][-][-]
        8.4.2 | Val:    131.00 | Ev: 3 | [1][1][1][-][-][-][-][-][-][-]
                               .
                               .
                               .
 [SytemScheduleInfo]: 132 evalutated schedules not printed... 
 Schedule printing truncated at 10 given ConsoleLogMode = 'truncate'. Top 10 shown above. 
 (Note: these 132 generated and evlauted this scheduler timestep (from either/both carried over and new schedules).
--------------------------------------------------------------------------------


================================================================================
SCHEDULE SUMMARY - Step 3 in   0.0199s | Total Schedules:      87 
 Status: 30.0% ... Generated:    76 | Carried Over:    11 | Cropped:   131
================================================================================
Time:  [ 0][ 1][ 2][ 3][-][-][-][-][-][-]
--------------------------------------------------------------------------------
      5.2.4.1 | Val:    240.00 | Ev: 4 | [1][1][1][1][-][-][-][-][-][-]
      5.1.5.1 | Val:    240.00 | Ev: 4 | [1][1][1][1][-][-][-][-][-][-]
      5.4.2.1 | Val:    240.00 | Ev: 4 | [1][1][1][1][-][-][-][-][-][-]
      5.5.1.1 | Val:    240.00 | Ev: 4 | [1][1][1][1][-][-][-][-][-][-]
      5.4.2.2 | Val:    200.00 | Ev: 4 | [1][1][1][1][-][-][-][-][-][-]
      5.1.5.2 | Val:    200.00 | Ev: 4 | [1][1][1][1][-][-][-][-][-][-]
      5.5.1.2 | Val:    200.00 | Ev: 4 | [1][1][1][1][-][-][-][-][-][-]
      5.5.1.4 | Val:    200.00 | Ev: 4 | [1][1][1][1][-][-][-][-][-][-]
      5.2.4.4 | Val:    200.00 | Ev: 4 | [1][1][1][1][-][-][-][-][-][-]
      5.1.5.4 | Val:    200.00 | Ev: 4 | [1][1][1][1][-][-][-][-][-][-]
      5.4.2.4 | Val:    200.00 | Ev: 4 | [1][1][1][1][-][-][-][-][-][-]
                               .
                               .
                               .
 [SytemScheduleInfo]: 77 evalutated schedules not printed... 
 Schedule printing truncated at 10 given ConsoleLogMode = 'truncate'. Top 10 shown above. 
 (Note: these 77 generated and evlauted this scheduler timestep (from either/both carried over and new schedules).
--------------------------------------------------------------------------------


================================================================================
SCHEDULE SUMMARY - Step 4 in   0.1308s | Total Schedules:     555 
 Status: 40.0% ... Generated:   468 | Carried Over:    87 | Cropped:     0
================================================================================
Time:  [ 0][ 1][ 2][ 3][ 4][-][-][-][-][-]
--------------------------------------------------------------------------------
    5.4.2.6.1 | Val:    251.00 | Ev: 5 | [1][1][1][1][1][-][-][-][-][-]
    5.5.1.4.3 | Val:    251.00 | Ev: 5 | [1][1][1][1][1][-][-][-][-][-]
    5.5.1.1.6 | Val:    251.00 | Ev: 5 | [1][1][1][1][1][-][-][-][-][-]
    6.2.4.5.1 | Val:    251.00 | Ev: 5 | [1][1][1][1][1][-][-][-][-][-]
    6.2.4.2.4 | Val:    251.00 | Ev: 5 | [1][1][1][1][1][-][-][-][-][-]
    5.1.5.1.6 | Val:    251.00 | Ev: 5 | [1][1][1][1][1][-][-][-][-][-]
    5.5.1.3.4 | Val:    251.00 | Ev: 5 | [1][1][1][1][1][-][-][-][-][-]
    5.1.5.3.4 | Val:    251.00 | Ev: 5 | [1][1][1][1][1][-][-][-][-][-]
    6.5.1.2.4 | Val:    251.00 | Ev: 5 | [1][1][1][1][1][-][-][-][-][-]
    5.4.3.5.1 | Val:    251.00 | Ev: 5 | [1][1][1][1][1][-][-][-][-][-]
    6.5.1.5.1 | Val:    251.00 | Ev: 5 | [1][1][1][1][1][-][-][-][-][-]
                               .
                               .
                               .
 [SytemScheduleInfo]: 545 evalutated schedules not printed... 
 Schedule printing truncated at 10 given ConsoleLogMode = 'truncate'. Top 10 shown above. 
 (Note: these 545 generated and evlauted this scheduler timestep (from either/both carried over and new schedules).
--------------------------------------------------------------------------------


================================================================================
SCHEDULE SUMMARY - Step 5 in   0.0534s | Total Schedules:      35 
 Status: 50.0% ... Generated:    24 | Carried Over:    11 | Cropped:   544
================================================================================
Time:  [ 0][ 1][ 2][ 3][ 4][ 5][-][-][-][-]
--------------------------------------------------------------------------------
  5.2.4.3.4.8 | Val:    262.00 | Ev: 6 | [1][1][1][1][1][1][-][-][-][-]
  5.5.1.6.1.8 | Val:    262.00 | Ev: 6 | [1][1][1][1][1][1][-][-][-][-]
  5.1.5.4.3.8 | Val:    262.00 | Ev: 6 | [1][1][1][1][1][1][-][-][-][-]
  5.4.2.4.3.8 | Val:    262.00 | Ev: 6 | [1][1][1][1][1][1][-][-][-][-]
  5.3.4.5.1.8 | Val:    262.00 | Ev: 6 | [1][1][1][1][1][1][-][-][-][-]
  5.4.2.3.4.8 | Val:    262.00 | Ev: 6 | [1][1][1][1][1][1][-][-][-][-]
  5.1.6.5.1.8 | Val:    262.00 | Ev: 6 | [1][1][1][1][1][1][-][-][-][-]
  5.2.4.6.1.8 | Val:    262.00 | Ev: 6 | [1][1][1][1][1][1][-][-][-][-]
  5.1.6.2.4.8 | Val:    262.00 | Ev: 6 | [1][1][1][1][1][1][-][-][-][-]
  5.1.5.6.1.8 | Val:    262.00 | Ev: 6 | [1][1][1][1][1][1][-][-][-][-]
  5.4.2.3.4.9 | Val:    253.00 | Ev: 6 | [1][1][1][1][1][1][-][-][-][-]
                               .
                               .
                               .
 [SytemScheduleInfo]: 25 evalutated schedules not printed... 
 Schedule printing truncated at 10 given ConsoleLogMode = 'truncate'. Top 10 shown above. 
 (Note: these 25 generated and evlauted this scheduler timestep (from either/both carried over and new schedules).
--------------------------------------------------------------------------------


================================================================================
SCHEDULE SUMMARY - Step 6 in   0.0561s | Total Schedules:     225 
 Status: 60.0% ... Generated:   190 | Carried Over:    35 | Cropped:     0
================================================================================
Time:  [ 0][ 1][ 2][ 3][ 4][ 5][ 6][-][-][-]
--------------------------------------------------------------------------------
 5.4.2.3.4.8.1 | Val:    362.00 | Ev: 7 | [1][1][1][1][1][1][1][-][-][-]
 5.2.4.6.1.8.1 | Val:    362.00 | Ev: 7 | [1][1][1][1][1][1][1][-][-][-]
 5.5.1.6.1.8.1 | Val:    362.00 | Ev: 7 | [1][1][1][1][1][1][1][-][-][-]
 5.1.6.5.1.8.1 | Val:    362.00 | Ev: 7 | [1][1][1][1][1][1][1][-][-][-]
 5.4.2.4.3.8.1 | Val:    362.00 | Ev: 7 | [1][1][1][1][1][1][1][-][-][-]
 5.1.5.6.1.8.1 | Val:    362.00 | Ev: 7 | [1][1][1][1][1][1][1][-][-][-]
 5.2.4.3.4.8.1 | Val:    362.00 | Ev: 7 | [1][1][1][1][1][1][1][-][-][-]
 5.1.6.2.4.8.1 | Val:    362.00 | Ev: 7 | [1][1][1][1][1][1][1][-][-][-]
 5.3.4.5.1.8.1 | Val:    362.00 | Ev: 7 | [1][1][1][1][1][1][1][-][-][-]
 5.1.5.4.3.8.1 | Val:    362.00 | Ev: 7 | [1][1][1][1][1][1][1][-][-][-]
 5.4.2.3.4.8.2 | Val:    322.00 | Ev: 7 | [1][1][1][1][1][1][1][-][-][-]
                               .
                               .
                               .
 [SytemScheduleInfo]: 215 evalutated schedules not printed... 
 Schedule printing truncated at 10 given ConsoleLogMode = 'truncate'. Top 10 shown above. 
 (Note: these 215 generated and evlauted this scheduler timestep (from either/both carried over and new schedules).
--------------------------------------------------------------------------------


================================================================================
SCHEDULE SUMMARY - Step 7 in   0.0319s | Total Schedules:      35 
 Status: 70.0% ... Generated:    24 | Carried Over:    11 | Cropped:   214
================================================================================
Time:  [ 0][ 1][ 2][ 3][ 4][ 5][ 6][ 7][-][-]
--------------------------------------------------------------------------------
 5.2.4.6.1.8.1.6 | Val:    373.00 | Ev: 8 | [1][1][1][1][1][1][1][1][-][-]
 5.4.2.3.4.8.1.6 | Val:    373.00 | Ev: 8 | [1][1][1][1][1][1][1][1][-][-]
 5.4.2.4.3.8.1.6 | Val:    373.00 | Ev: 8 | [1][1][1][1][1][1][1][1][-][-]
 5.1.5.4.3.8.1.6 | Val:    373.00 | Ev: 8 | [1][1][1][1][1][1][1][1][-][-]
 5.5.1.6.1.8.1.6 | Val:    373.00 | Ev: 8 | [1][1][1][1][1][1][1][1][-][-]
 5.1.6.5.1.8.1.6 | Val:    373.00 | Ev: 8 | [1][1][1][1][1][1][1][1][-][-]
 5.1.6.2.4.8.1.6 | Val:    373.00 | Ev: 8 | [1][1][1][1][1][1][1][1][-][-]
 5.1.5.6.1.8.1.6 | Val:    373.00 | Ev: 8 | [1][1][1][1][1][1][1][1][-][-]
 5.3.4.5.1.8.1.6 | Val:    373.00 | Ev: 8 | [1][1][1][1][1][1][1][1][-][-]
 5.2.4.3.4.8.1.6 | Val:    373.00 | Ev: 8 | [1][1][1][1][1][1][1][1][-][-]
 5.1.6.2.4.8.1.9 | Val:    364.00 | Ev: 8 | [1][1][1][1][1][1][1][1][-][-]
                               .
                               .
                               .
 [SytemScheduleInfo]: 25 evalutated schedules not printed... 
 Schedule printing truncated at 10 given ConsoleLogMode = 'truncate'. Top 10 shown above. 
 (Note: these 25 generated and evlauted this scheduler timestep (from either/both carried over and new schedules).
--------------------------------------------------------------------------------


================================================================================
SCHEDULE SUMMARY - Step 8 in   0.0346s | Total Schedules:     135 
 Status: 80.0% ... Generated:   100 | Carried Over:    35 | Cropped:     0
================================================================================
Time:  [ 0][ 1][ 2][ 3][ 4][ 5][ 6][ 7][ 8][-]
--------------------------------------------------------------------------------
 5.2.4.3.4.8.1.6.8 | Val:    384.00 | Ev: 9 | [1][1][1][1][1][1][1][1][1][-]
 5.4.2.3.4.8.1.6.8 | Val:    384.00 | Ev: 9 | [1][1][1][1][1][1][1][1][1][-]
 5.2.4.6.1.8.1.9.5 | Val:    384.00 | Ev: 9 | [1][1][1][1][1][1][1][1][1][-]
 5.1.5.4.3.8.1.6.8 | Val:    384.00 | Ev: 9 | [1][1][1][1][1][1][1][1][1][-]
 5.1.5.6.1.8.1.6.8 | Val:    384.00 | Ev: 9 | [1][1][1][1][1][1][1][1][1][-]
 5.5.1.6.1.8.1.9.5 | Val:    384.00 | Ev: 9 | [1][1][1][1][1][1][1][1][1][-]
 5.2.4.6.1.8.1.6.8 | Val:    384.00 | Ev: 9 | [1][1][1][1][1][1][1][1][1][-]
 5.4.2.3.4.8.1.9.5 | Val:    384.00 | Ev: 9 | [1][1][1][1][1][1][1][1][1][-]
 5.3.4.5.1.8.1.9.5 | Val:    384.00 | Ev: 9 | [1][1][1][1][1][1][1][1][1][-]
 5.1.5.6.1.8.1.9.5 | Val:    384.00 | Ev: 9 | [1][1][1][1][1][1][1][1][1][-]
 5.1.5.4.3.8.1.9.5 | Val:    384.00 | Ev: 9 | [1][1][1][1][1][1][1][1][1][-]
                               .
                               .
                               .
 [SytemScheduleInfo]: 125 evalutated schedules not printed... 
 Schedule printing truncated at 10 given ConsoleLogMode = 'truncate'. Top 10 shown above. 
 (Note: these 125 generated and evlauted this scheduler timestep (from either/both carried over and new schedules).
--------------------------------------------------------------------------------


================================================================================
SCHEDULE SUMMARY - Step 9 in   0.0314s | Total Schedules:      75 
 Status: 90.0% ... Generated:    64 | Carried Over:    11 | Cropped:   124
================================================================================
Time:  [ 0][ 1][ 2][ 3][ 4][ 5][ 6][ 7][ 8][ 9]
--------------------------------------------------------------------------------
 5.5.1.6.1.8.1.6.8.2 | Val:    444.00 | Ev:10 | [1][1][1][1][1][1][1][1][1][1]
 5.4.2.4.3.8.1.6.8.2 | Val:    444.00 | Ev:10 | [1][1][1][1][1][1][1][1][1][1]
 5.1.6.5.1.8.1.6.8.2 | Val:    444.00 | Ev:10 | [1][1][1][1][1][1][1][1][1][1]
 5.1.6.2.4.8.1.9.5.2 | Val:    444.00 | Ev:10 | [1][1][1][1][1][1][1][1][1][1]
 5.1.6.2.4.8.1.6.8.2 | Val:    444.00 | Ev:10 | [1][1][1][1][1][1][1][1][1][1]
 5.3.4.5.1.8.1.6.8.2 | Val:    444.00 | Ev:10 | [1][1][1][1][1][1][1][1][1][1]
 5.2.4.3.4.8.1.9.5.2 | Val:    444.00 | Ev:10 | [1][1][1][1][1][1][1][1][1][1]
 5.4.2.4.3.8.1.9.5.2 | Val:    444.00 | Ev:10 | [1][1][1][1][1][1][1][1][1][1]
 5.1.5.4.3.8.1.9.5.2 | Val:    444.00 | Ev:10 | [1][1][1][1][1][1][1][1][1][1]
 5.1.6.5.1.8.1.9.5.2 | Val:    444.00 | Ev:10 | [1][1][1][1][1][1][1][1][1][1]
 5.1.6.2.4.8.1.9.5.3 | Val:    435.00 | Ev:10 | [1][1][1][1][1][1][1][1][1][1]
                               .
                               .
                               .
 [SytemScheduleInfo]: 65 evalutated schedules not printed... 
 Schedule printing truncated at 10 given ConsoleLogMode = 'truncate'. Top 10 shown above. 
 (Note: these 65 generated and evlauted this scheduler timestep (from either/both carried over and new schedules).
--------------------------------------------------------------------------------


████████████████████████████████████████████████████████████████████████████████
FINAL SCHEDULES (after final crop)
████████████████████████████████████████████████████████████████████████████████

================================================================================
SCHEDULE SUMMARY - Step FINAL in   0.4220s | Total Schedules:      75 
 Status: 90.0% ... Generated:    64 | Carried Over:    11 | Cropped:     0
================================================================================
Time:  [ 0][ 1][ 2][ 3][ 4][ 5][ 6][ 7][ 8][ 9]
--------------------------------------------------------------------------------
 5.5.1.6.1.8.1.6.8.2 | Val:    444.00 | Ev:10 | Hash:4f93d81e01ab82b6 | [1][1][1][1][1][1][1][1][1][1]
 5.4.2.4.3.8.1.6.8.2 | Val:    444.00 | Ev:10 | Hash:c11c4820dbb26d9a | [1][1][1][1][1][1][1][1][1][1]
 5.1.6.5.1.8.1.6.8.2 | Val:    444.00 | Ev:10 | Hash:198980c2f714f594 | [1][1][1][1][1][1][1][1][1][1]
 5.1.6.2.4.8.1.9.5.2 | Val:    444.00 | Ev:10 | Hash:0c97b987eb9f0cb5 | [1][1][1][1][1][1][1][1][1][1]
 5.1.6.2.4.8.1.6.8.2 | Val:    444.00 | Ev:10 | Hash:927b1d0e101c5e58 | [1][1][1][1][1][1][1][1][1][1]
 5.3.4.5.1.8.1.6.8.2 | Val:    444.00 | Ev:10 | Hash:d3dd1838613595ad | [1][1][1][1][1][1][1][1][1][1]
 5.2.4.3.4.8.1.9.5.2 | Val:    444.00 | Ev:10 | Hash:ce61cdd75a8b3b95 | [1][1][1][1][1][1][1][1][1][1]
 5.4.2.4.3.8.1.9.5.2 | Val:    444.00 | Ev:10 | Hash:a9241eb2b000d4f6 | [1][1][1][1][1][1][1][1][1][1]
 5.1.5.4.3.8.1.9.5.2 | Val:    444.00 | Ev:10 | Hash:b5ccada137b5d310 | [1][1][1][1][1][1][1][1][1][1]
 5.1.6.5.1.8.1.9.5.2 | Val:    444.00 | Ev:10 | Hash:048942956f437f98 | [1][1][1][1][1][1][1][1][1][1]
 5.1.6.2.4.8.1.9.5.3 | Val:    435.00 | Ev:10 | Hash:5a404e0f0bb6c4eb | [1][1][1][1][1][1][1][1][1][1]
                               .
                               .
                               .
 [SytemScheduleInfo]: 65 evalutated schedules not printed... 
 Schedule printing truncated at 10 given ConsoleLogMode = 'truncate'. Top 10 shown above. 
 (Note: these 65 generated and evlauted this scheduler timestep (from either/both carried over and new schedules).
--------------------------------------------------------------------------------
SCHEDULER TOTAL TIME: 0.422 seconds
--------------------------------------------------------------------------------

Publishing simulation results to test/HSFSchedulerUnitTest/GenerateProgramHashes/PreRefactorOutput/last_run_2025-12-01_03-02-05_TwoAssetImaging_ToyExample
Simulation results published to test/HSFSchedulerUnitTest/GenerateProgramHashes/PreRefactorOutput/last_run_2025-12-01_03-02-05_TwoAssetImaging_ToyExample
TOTAL PROGRAM TIME: 3.584 seconds

